{
  "schema": "DreamSessionCheckpointV1",
  "schemaVersion": 1,
  "sessionId": "dream-session-b4d4135a7e9b",
  "seed": 777,
  "maxBeats": 3,
  "completedBeats": 3,
  "nextBeatIndex": 4,
  "endedBecause": "max_beats",
  "isComplete": true,
  "beats": [
    {
      "schema": "DreamSessionBeatV1",
      "schemaVersion": 1,
      "index": 1,
      "passage": {
        "schema": "PassageV1",
        "schemaVersion": 1,
        "id": "candle_refuses_dark",
        "motifs": [
          "light",
          "threshold",
          "memory"
        ],
        "pressureTags": [
          "hope",
          "refusal"
        ],
        "formTags": [
          "candle",
          "dim_room",
          "held_flame"
        ],
        "intensityBand": "gentle",
        "allowedResponseKinds": [
          "protect",
          "speak",
          "wait",
          "alter_object"
        ],
        "returnAnchorTags": [
          "lamp",
          "note",
          "hearth"
        ],
        "variationFamily": "unspent_lights",
        "baseWeight": 1
      },
      "echoTrace": {
        "schema": "EchoTraceV1",
        "schemaVersion": 1,
        "passageId": "candle_refuses_dark",
        "motifsTouched": [
          "light",
          "threshold",
          "memory"
        ],
        "gestureTags": [
          "approached",
          "approach"
        ],
        "tempo": "unhurried",
        "pressureAccepted": 0.4,
        "returnAnchorUsed": false,
        "boundarySignals": [],
        "dreamflowDeltas": {}
      },
      "sessionArc": {
        "schema": "SessionArcV1",
        "schemaVersion": 1,
        "phase": "deepening",
        "beatCount": 1,
        "pressure": 0.159,
        "returnReadiness": 0.025,
        "continuationSeed": 3928974574,
        "recentBeatRoles": [
          "pressure"
        ],
        "boundarySignalCount": 0,
        "lastDecision": "deepen",
        "weightOverrides": {
          "space_black_hole": 1.2,
          "white_void": 1.1
        }
      },
      "arcDirective": {
        "schema": "SessionArcDirectiveV1",
        "schemaVersion": 1,
        "decision": "deepen",
        "suggestedRole": "pressure",
        "pressureDelta": 0.159,
        "returnAvailable": false,
        "weightOverrides": {
          "space_black_hole": 1.2,
          "white_void": 1.1
        }
      },
      "selectedDream": {
        "id": "space_black_hole",
        "name": "Space / Black Hole",
        "symbolicTags": [
          "annihilation",
          "rebirth",
          "cosmic mystery"
        ],
        "weightBreakdown": {
          "base": 1,
          "archetype": 2.325,
          "vibe": -0.038,
          "room": 0.25,
          "portal": 0.35,
          "directorMultiplier": 1.2,
          "total": 4.665,
          "roll": 13.14156
        }
      },
      "dreamJourney": {
        "schema": "DreamJourneyV1",
        "beats": [
          {
            "role": "entry",
            "moduleId": "white_void",
            "moduleName": "Boundless White Void",
            "symbolicTags": [
              "boundlessness",
              "dissolution",
              "silence"
            ],
            "weightBreakdown": {
              "base": 1,
              "archetype": 2.69,
              "vibe": 1.005,
              "room": 0.25,
              "portal": 0.35,
              "directorMultiplier": 1.1,
              "total": 5.824,
              "roll": 9.3456
            }
          },
          {
            "role": "pressure",
            "moduleId": "space_black_hole",
            "moduleName": "Space / Black Hole",
            "symbolicTags": [
              "annihilation",
              "rebirth",
              "cosmic mystery"
            ],
            "weightBreakdown": {
              "base": 1,
              "archetype": 2.325,
              "vibe": -0.038,
              "room": 0.25,
              "portal": 0.35,
              "directorMultiplier": 1.2,
              "total": 4.665,
              "roll": 13.14156
            }
          },
          {
            "role": "mirror",
            "moduleId": "space_black_hole",
            "moduleName": "Space / Black Hole",
            "symbolicTags": [
              "annihilation",
              "rebirth",
              "cosmic mystery"
            ],
            "weightBreakdown": {
              "base": 1,
              "archetype": 2.325,
              "vibe": -0.038,
              "room": 0.25,
              "portal": 0.35,
              "directorMultiplier": 1.2,
              "total": 4.665,
              "roll": 14.57627
            }
          },
          {
            "role": "return",
            "moduleId": "white_void",
            "moduleName": "Boundless White Void",
            "symbolicTags": [
              "boundlessness",
              "dissolution",
              "silence"
            ],
            "weightBreakdown": {
              "base": 1,
              "archetype": 2.69,
              "vibe": 1.005,
              "room": 0.25,
              "portal": 0.35,
              "directorMultiplier": 1.1,
              "total": 5.824,
              "roll": 7.47346
            }
          }
        ],
        "symbolTrail": [
          "boundlessness",
          "dissolution",
          "silence",
          "annihilation",
          "rebirth",
          "cosmic mystery"
        ],
        "summary": "entry:Boundless White Void -> pressure:Space / Black Hole -> mirror:Space / Black Hole -> return:Boundless White Void"
      },
      "dreamWeather": {
        "schema": "DreamWeatherV1",
        "schemaVersion": 1,
        "weatherId": "weather-1b3iese",
        "mood": "stillness",
        "pressure": "low",
        "ceiling": 0.35,
        "dreadBudget": {
          "pursuit": 0.034,
          "bodyUnease": 0.167,
          "cosmicDread": 0.157,
          "disorientation": 0.022,
          "loss": 0.122,
          "watching": 0.17,
          "claustrophobia": 0.131
        },
        "weatherTags": [
          "silence",
          "threshold",
          "annihilation",
          "rebirth",
          "cosmic_mystery",
          "memory"
        ],
        "suppressedTags": [],
        "atmosphere": {
          "lightIntensity": 0.742,
          "fogDensity": 0.346,
          "bloom": 0.28,
          "exposure": 0.48,
          "warmth": 0.57,
          "movementDrag": 0.277
        }
      },
      "weatherTrace": {
        "schema": "WeatherTraceV1",
        "schemaVersion": 1,
        "traceId": "weather-trace-1b3iese",
        "weatherId": "weather-1b3iese",
        "mood": "stillness",
        "pressure": "low",
        "sourceTags": [
          "annihilation",
          "rebirth",
          "cosmic_mystery",
          "threshold",
          "memory"
        ],
        "resultingTags": [
          "silence",
          "threshold",
          "annihilation",
          "rebirth",
          "cosmic_mystery",
          "memory"
        ],
        "suppressedTags": [],
        "strongestDreadAxis": "watching"
      },
      "returnAvailable": false
    },
    {
      "schema": "DreamSessionBeatV1",
      "schemaVersion": 1,
      "index": 2,
      "passage": {
        "schema": "PassageV1",
        "schemaVersion": 1,
        "id": "candle_refuses_dark",
        "motifs": [
          "light",
          "threshold",
          "memory"
        ],
        "pressureTags": [
          "hope",
          "refusal"
        ],
        "formTags": [
          "candle",
          "dim_room",
          "held_flame"
        ],
        "intensityBand": "gentle",
        "allowedResponseKinds": [
          "protect",
          "speak",
          "wait",
          "alter_object"
        ],
        "returnAnchorTags": [
          "lamp",
          "note",
          "hearth"
        ],
        "variationFamily": "unspent_lights",
        "baseWeight": 1
      },
      "echoTrace": {
        "schema": "EchoTraceV1",
        "schemaVersion": 1,
        "passageId": "candle_refuses_dark",
        "motifsTouched": [
          "light",
          "threshold",
          "memory"
        ],
        "gestureTags": [
          "answered",
          "speak"
        ],
        "tempo": "unhurried",
        "pressureAccepted": 0.48,
        "returnAnchorUsed": false,
        "boundarySignals": [],
        "dreamflowDeltas": {}
      },
      "sessionArc": {
        "schema": "SessionArcV1",
        "schemaVersion": 1,
        "phase": "mirroring",
        "beatCount": 2,
        "pressure": 0.336,
        "returnReadiness": 0.235,
        "continuationSeed": 2476735975,
        "recentBeatRoles": [
          "pressure",
          "mirror"
        ],
        "boundarySignalCount": 0,
        "lastDecision": "mirror",
        "weightOverrides": {
          "mirror_hall": 1.264
        }
      },
      "arcDirective": {
        "schema": "SessionArcDirectiveV1",
        "schemaVersion": 1,
        "decision": "mirror",
        "suggestedRole": "mirror",
        "pressureDelta": 0.177,
        "returnAvailable": false,
        "weightOverrides": {
          "mirror_hall": 1.264
        }
      },
      "selectedDream": {
        "id": "garden",
        "name": "Garden",
        "symbolicTags": [
          "growth",
          "innocence",
          "fertility",
          "beauty"
        ],
        "weightBreakdown": {
          "base": 1,
          "archetype": 1.87,
          "vibe": 0.42,
          "room": 0.25,
          "portal": 0.35,
          "directorMultiplier": 1,
          "total": 3.89,
          "roll": 4.27059
        }
      },
      "dreamJourney": {
        "schema": "DreamJourneyV1",
        "beats": [
          {
            "role": "entry",
            "moduleId": "garden",
            "moduleName": "Garden",
            "symbolicTags": [
              "growth",
              "innocence",
              "fertility",
              "beauty"
            ],
            "weightBreakdown": {
              "base": 1,